<?xml version="1.0"?>
<!--
To change this license header, choose License Headers in Project Properties.
To change this template file, choose Tools | Templates
and open the template in the editor.
-->

<xs:schema  version="1.0"
            targetNamespace="http://myGame/profile"
            xmlns="http://myGame/profile"
            xmlns:xs="http://www.w3.org/2001/XMLSchema"
            elementFormDefault="qualified">
    
            <xs:element name="profile" type="Profile"/>
            <xs:complexType name="Profile">
                <xs:sequence>
                    <xs:element name="name" type="xs:string"/>
                    <xs:element name="avatar" type="xs:string"/>
                    <xs:element name="birthday" type="xs:date"/>
                    <xs:element name="games" type="Games"/>
                </xs:sequence>
            </xs:complexType>    
            <xs:complexType name="Games">
                <xs:sequence>
                    <xs:element name="game" type="Game" maxOccurs="unbounded" minOccurs="0"/>
                </xs:sequence>
            </xs:complexType>
            <xs:complexType name="Game">
                <xs:all>
                    <xs:element name="time" type="xs:int" minOccurs="0"/>
                    <xs:element name="word" type="Word"/>
                </xs:all>
                <xs:attribute name="date" type="xs:date"/>
                <xs:attribute name="found" type="Found"/>
            </xs:complexType>
            <xs:complexType name="Word">
                <xs:simpleContent>
                    <xs:extension base="xs:string">
                        <xs:attribute name="level" type="Level"/>
                    </xs:extension>
                </xs:simpleContent>
            </xs:complexType>
            <xs:simpleType name="Found">
                <xs:restriction base="xs:int">
                    <xs:pattern value="[0-9]{2}"/>
                </xs:restriction>
            </xs:simpleType>
            <xs:simpleType name="Level">
                <xs:restriction base="xs:int">
                    <xs:pattern value="[1-5]"/>
                </xs:restriction>
            </xs:simpleType>
</xs:schema>
